topic,top_words
0,"film, story, love, life, great, man, time, young, war, best, world, good, movie, wife, does"
1,"film, good, great, story, love, series, like, time, just, really, best, characters, episode, version, better"
2,"movie, just, film, like, bad, really, good, don, time, movies, acting, make, seen, plot, watch"
3,"film, story, films, characters, like, movie, character, just, director, way, time, horror, man, scenes, good"
4,"movie, like, people, just, time, think, film, funny, good, movies, watch, really, great, love, life"
